Series Number,Filename,Name,Description,Gender,Attributes,UUID
TEAM BEVEL,,,,,,
1,adewale-the-amebo,adewale the amebo,adewale the amebo,male,"hair: bald; eyes: black; teeth: none; clothing: red; accessories: mask; expression: none; strenght: powerful; weaknees: curiosity",cad316c3-37f8-4b27-9f53-9d803bfcfee7
2,alli-the-queeny,alli the queeny,Alli is an LGBT Stan.,male,"hair: bald; eyes: white; teeth: none; clothing: yellow; accessories: mask; expression: none; strength: powerful; weaknees: none",a57ecda4-a26f-4e97-a757-e1800af39aab
3,aminat-the-snnobish,aminat the snnobish,Aminat never really wants to talk to anyone.,female,"hair: brown bun; eyes: none; teeth: none; clothing: yellow; accessories: glasses; expression: blank; strength: none; weakness: attitude",0e37ed0d-3e84-4f32-a91f-ec9c4ba8c7de
4,aminu-the-carpenter,aminu the carpenter,"Aminu's hands are blessed, he makes the best furniture in the whole of Kano.",male,"hair: bald; eyes: blue; teeth: none; clothing: yellow; accessories: mask; expression: none; strenght: powerful; weaknees: none",4f30b751-96e7-40fe-97fd-e3d44973ff2f
